{
  "backend_acknowledgement": {
    "process_started": true,
    "stdin_delivery": "not_requested"
  },
  "composer_state_after": "NOT_APPLICABLE",
  "composer_state_before": "NOT_APPLICABLE",
  "delivery_status": "CONFIRMED",
  "endpoint_lease_sha256": "sha256:2e11ca80d06f68ba48f7a86f134bac9b06ccb161e485d634661afdf24d9f72a4",
  "errors": [],
  "provider_execution_status": "NOT_APPLICABLE",
  "schema": "tau.runtime_submit_receipt.v1",
  "submit_attempt_count": 1,
  "text_delivery_count": 0,
  "work_order_sha256": "sha256:47c3e5e72a22a37cbb50776c9057852d897f4ffe2f8ec2efe742b9d22dce629f"
}
