{
  "backend_acknowledgement": {
    "process_started": true,
    "stdin_delivery": "not_requested"
  },
  "composer_state_after": "NOT_APPLICABLE",
  "composer_state_before": "NOT_APPLICABLE",
  "delivery_status": "CONFIRMED",
  "endpoint_lease_sha256": "sha256:482f74a343f6874ba612161ee4f2a254e37df7787dda39d1ff979dc7c3c98c14",
  "errors": [],
  "provider_execution_status": "NOT_APPLICABLE",
  "schema": "tau.runtime_submit_receipt.v1",
  "submit_attempt_count": 1,
  "text_delivery_count": 0,
  "work_order_sha256": "sha256:904e5a8a7fb93046be00190b8664ebe1c6b748e762434760d6af3f74214ca778"
}
