{
  "backend_acknowledgement": {
    "process_started": true,
    "stdin_delivery": "not_requested"
  },
  "composer_state_after": "NOT_APPLICABLE",
  "composer_state_before": "NOT_APPLICABLE",
  "delivery_status": "CONFIRMED",
  "endpoint_lease_sha256": "sha256:671993be1a93e7a284b204ffc5f6a6171565e7649bea6d05f6652ff2f6e550ed",
  "errors": [],
  "provider_execution_status": "NOT_APPLICABLE",
  "schema": "tau.runtime_submit_receipt.v1",
  "submit_attempt_count": 1,
  "text_delivery_count": 0,
  "work_order_sha256": "sha256:cda794809dfd8dbb55ef2270b1b4b82305d7085a42dd1a4b9bd7951113c1bd39"
}
