{
  "backend_acknowledgement": {
    "process_started": true,
    "stdin_delivery": "not_requested"
  },
  "composer_state_after": "NOT_APPLICABLE",
  "composer_state_before": "NOT_APPLICABLE",
  "delivery_status": "CONFIRMED",
  "endpoint_lease_sha256": "sha256:ccc6750964141fc3e1039cb0919aa0ba1b2fd28ba58c8871392e3079f7142105",
  "errors": [],
  "provider_execution_status": "NOT_APPLICABLE",
  "schema": "tau.runtime_submit_receipt.v1",
  "submit_attempt_count": 1,
  "text_delivery_count": 0,
  "work_order_sha256": "sha256:4a9e1c168fcbda5fa3f2c2aa244f8bf2ede0397279565ec2a5f69a5368516227"
}
