{
  "backend_acknowledgement": {
    "process_started": true,
    "stdin_delivery": "not_requested"
  },
  "composer_state_after": "NOT_APPLICABLE",
  "composer_state_before": "NOT_APPLICABLE",
  "delivery_status": "CONFIRMED",
  "endpoint_lease_sha256": "sha256:a4872b2cd5c09720c67ad149c246a3d3e2ad9043a0057ca49db3e8ad64b9c8c3",
  "errors": [],
  "provider_execution_status": "NOT_APPLICABLE",
  "schema": "tau.runtime_submit_receipt.v1",
  "submit_attempt_count": 1,
  "text_delivery_count": 0,
  "work_order_sha256": "sha256:de89b8c9e9a320a749e251b44c45d83c94f5617a2c73428e13ff14950bdf15e6"
}
